{
  "generated_by": "merge_findings",
  "schema_version": "1.0.0",
  "session_id": "synth-case-15-apply-round-trip",
  "artifact_path": "tests/fixtures/eval/case_15_apply_round_trip.SKILL.md",
  "artifact_type": "skill",
  "findings": [
    {
      "id": "SP-2b:tests/fixtures/eval/case_15_apply_round_trip.SKILL.md:Safety/v1",
      "checklist_item": "SP-2b",
      "dimension": "Safety",
      "severity": "High",
      "evidence": "line 4; match='Write' present in allowed-tools without disable-model-invocation: true",
      "primary_focus": true,
      "owner_conflict": false,
      "hint_owner": null,
      "path": "tests/fixtures/eval/case_15_apply_round_trip.SKILL.md",
      "line_range": "4",
      "why": "Binary rubric item SP-2b FAIL per scripts/rubric_binary_evaluator.py. Write-class tools require an explicit disable-model-invocation gate.",
      "validation": "Re-run scripts/rubric_binary_evaluator.py on the artifact and confirm SP-2b verdict PASS.",
      "current": "allowed-tools: Read, Write, Glob",
      "recommended": "allowed-tools: Read, Write, Glob\ndisable-model-invocation: true",
      "perspective": "binary-evaluator"
    },
    {
      "id": "META-2:tests/fixtures/eval/case_15_apply_round_trip.SKILL.md:Metadata/v1",
      "checklist_item": "META-2",
      "dimension": "Metadata",
      "severity": "Medium",
      "evidence": "line 3; match='Reviews configuration files and updates settings in the target directory.' — description lacks a do-not-use / not-for / skip-when exclusion phrase.",
      "primary_focus": true,
      "owner_conflict": false,
      "hint_owner": null,
      "path": "tests/fixtures/eval/case_15_apply_round_trip.SKILL.md",
      "line_range": "3",
      "why": "Binary rubric item META-2 FAIL: description does not carry an exclusion phrase that tells the routing layer when NOT to invoke this skill.",
      "validation": "Re-run scripts/rubric_binary_evaluator.py and confirm META-2 verdict PASS.",
      "perspective": "binary-evaluator"
    }
  ]
}
